<mt-dictionaries-response
    xmlns="https://github.com/erasmus-without-paper/ewp-specs-api-mt-dictionaries/tree/stable-v1"
    xmlns:xsi="http://www.w3.org/2001/XMLSchema-instance"
    xsi:schemaLocation="
         https://github.com/erasmus-without-paper/ewp-specs-api-mt-dictionaries/tree/stable-v1
         https://raw.githubusercontent.com/erasmus-without-paper/ewp-specs-api-mt-dictionaries/stable-v1/response.xsd
     ">

    <!-- IMPORTANT: Please see the response.xsd file for detailed requirements and descriptions of all the elements. You 
        MUST NOT base your implementation solely on the example file. -->

    <!-- Example response for training_types dictionary -->

    <term>
        <code>J</code>
        <description>Job shadowing</description>
    </term>

    <term>
        <code>O</code>
        <description>Other</description>
    </term>

    <term>
        <code>T</code>
        <description>Training</description>
    </term>

    <term>
        <code>W</code>
        <description>Workshop</description>
    </term>

</mt-dictionaries-response>
